{"campaignId":"alpha1-white-goods","controls":[{"axis":"RUNTIME","controlId":"foundation-runtime","handler":"ENVIRONMENT_CAPABILITY","input":{"capability":"foundation-runtime","expected":true},"required":true},{"axis":"ASSURANCE","controlId":"foundation-assurance","handler":"ENVIRONMENT_CAPABILITY","input":{"capability":"foundation-assurance","expected":true},"required":true}],"description":"Alpha-1 foundation runtime and assurance campaign; unavailable target authority remains explicit in offline execution.","environmentFixture":"fixtures/alpha1/environment-unavailable.json","executionClass":"LIVE_CAMPAIGN","schemaVersion":"harness.planeon.ai/conformance-campaign/v1alpha1","version":"0.1.0"}
