{"campaignId":"parity-metadata","controls":[{"axis":"UNIT","controlId":"registry-authority","handler":"STATIC_ASSERTION","input":{"actual":"REFERENCE_ONLY","expected":"REFERENCE_ONLY"},"required":true},{"axis":"UNIT","controlId":"warm-source-execution","handler":"STATIC_ASSERTION","input":{"actual":false,"expected":false},"required":true}],"description":"Offline registry closure only; this campaign never executes or observes a warm source.","environmentFixture":"fixtures/environments/meta-complete.json","executionClass":"OFFLINE_TEST","schemaVersion":"harness.planeon.ai/conformance-campaign/v1alpha1","version":"0.1.0"}
